[
 {
  "atom_id": "heal-shield.heal",
  "family": "heal-shield",
  "behavior": "KSanteRConversionHealth",
  "trigger": "on_effect",
  "target_policy": "self",
  "parameters": {
   "cooldown": [
    8.0,
    8.0,
    8.0,
    8.0,
    8.0,
    8.0,
    8.0
   ],
   "cast_range": [
    450.0,
    450.0,
    450.0,
    450.0,
    450.0,
    450.0,
    450.0
   ],
   "mana_cost": null,
   "damage": null,
   "duration": null,
   "ratios": {},
   "tick_rate": null,
   "stacks_cap": null,
   "damage_type": "physical",
   "affects_type_flags": 22538
  },
  "states": [
   {
    "state": "cast",
    "duration": null,
    "behavior": "winding up",
    "atoms": [
     "heal-shield.heal"
    ]
   },
   {
    "state": "channel",
    "duration": null,
    "behavior": "channel",
    "atoms": [
     "heal-shield.heal"
    ]
   }
  ],
  "cycle": {
   "cooldown_seconds": {
    "rank1": 8.0,
    "rank_max": 8.0
   },
   "cast_time_seconds": null,
   "uptime_fraction": null,
   "reset_on": [],
   "tempo_class": "sustain"
  },
  "relations": [
   "heal-shield.grievous-wounds",
   "heal-shield.heal-amplification",
   "heal-shield.healing-negation",
   "heal-shield.overheal"
  ],
  "provenance": {
   "wiki": [
    "Healing",
    "Heal",
    "Health"
   ],
   "binary": [
    "{49b63a4c}"
   ],
   "evidence": "name:heal"
  }
 },
 {
  "atom_id": "stack-transform-summon-resource.transform",
  "family": "stack-transform-summon-resource",
  "behavior": "KsanteRTransform",
  "trigger": "on_effect",
  "target_policy": "self",
  "parameters": {
   "cooldown": null,
   "cast_range": null,
   "mana_cost": null,
   "damage": null,
   "duration": null,
   "ratios": {},
   "tick_rate": null,
   "stacks_cap": null,
   "damage_type": "physical",
   "affects_type_flags": null
  },
  "states": [],
  "cycle": {
   "cooldown_seconds": null,
   "cast_time_seconds": null,
   "uptime_fraction": null,
   "reset_on": [],
   "tempo_class": "utility"
  },
  "relations": [
   "stats.health",
   "stats.armor",
   "stats.attack-damage"
  ],
  "provenance": {
   "wiki": [
    "Buff",
    "Debuff",
    "Gnar",
    "Ability resource",
    "Manaless"
   ],
   "binary": [
    "{4d695bf6}"
   ],
   "evidence": "name:transform"
  }
 },
 {
  "atom_id": "crowd-control-mobility.root",
  "family": "crowd-control-mobility",
  "behavior": "KsanteRCastRoot",
  "trigger": "on_effect",
  "target_policy": "enemy",
  "parameters": {
   "cooldown": null,
   "cast_range": null,
   "mana_cost": null,
   "damage": null,
   "duration": null,
   "ratios": {},
   "tick_rate": null,
   "stacks_cap": null,
   "damage_type": "physical",
   "affects_type_flags": null
  },
  "states": [],
  "cycle": {
   "cooldown_seconds": null,
   "cast_time_seconds": null,
   "uptime_fraction": null,
   "reset_on": [],
   "tempo_class": "setup"
  },
  "relations": [],
  "provenance": {
   "wiki": [
    "Crowd control",
    "Types of Crowd Control",
    "Types of Crowd Control/Summary",
    "Dash",
    "Blink",
    "Cleanse"
   ],
   "binary": [
    "{646a8b25}"
   ],
   "evidence": "name:root"
  }
 },
 {
  "atom_id": "crowd-control-mobility.airborne",
  "family": "crowd-control-mobility",
  "behavior": "KsanteRKnockbackWall",
  "trigger": "on_effect",
  "target_policy": "enemy",
  "parameters": {
   "cooldown": null,
   "cast_range": null,
   "mana_cost": null,
   "damage": null,
   "duration": null,
   "ratios": {},
   "tick_rate": null,
   "stacks_cap": null,
   "damage_type": "physical",
   "affects_type_flags": null
  },
  "states": [],
  "cycle": {
   "cooldown_seconds": null,
   "cast_time_seconds": null,
   "uptime_fraction": null,
   "reset_on": [],
   "tempo_class": "utility"
  },
  "relations": [],
  "provenance": {
   "wiki": [
    "Crowd control",
    "Types of Crowd Control",
    "Types of Crowd Control/Summary",
    "Dash",
    "Blink"
   ],
   "binary": [
    "{74b90c41}"
   ],
   "evidence": "name:knockback"
  }
 },
 {
  "atom_id": "crowd-control-mobility.knockback",
  "family": "crowd-control-mobility",
  "behavior": "KsanteRKnockbackWall",
  "trigger": "on_effect",
  "target_policy": "enemy",
  "parameters": {
   "cooldown": null,
   "cast_range": null,
   "mana_cost": null,
   "damage": null,
   "duration": null,
   "ratios": {},
   "tick_rate": null,
   "stacks_cap": null,
   "damage_type": "physical",
   "affects_type_flags": null
  },
  "states": [],
  "cycle": {
   "cooldown_seconds": null,
   "cast_time_seconds": null,
   "uptime_fraction": null,
   "reset_on": [],
   "tempo_class": "utility"
  },
  "relations": [],
  "provenance": {
   "wiki": [
    "Types of Crowd Control"
   ],
   "binary": [
    "{74b90c41}"
   ],
   "evidence": "name:knockback"
  }
 },
 {
  "atom_id": "stack-transform-summon-resource.summoned-terrain-structure",
  "family": "stack-transform-summon-resource",
  "behavior": "KsanteRKnockbackWall",
  "trigger": "on_effect",
  "target_policy": "self",
  "parameters": {
   "cooldown": null,
   "cast_range": null,
   "mana_cost": null,
   "damage": null,
   "duration": null,
   "ratios": {},
   "tick_rate": null,
   "stacks_cap": null,
   "damage_type": "physical",
   "affects_type_flags": null
  },
  "states": [],
  "cycle": {
   "cooldown_seconds": null,
   "cast_time_seconds": null,
   "uptime_fraction": null,
   "reset_on": [],
   "tempo_class": "utility"
  },
  "relations": [],
  "provenance": {
   "wiki": [
    "Champion summoned units"
   ],
   "binary": [
    "{74b90c41}"
   ],
   "evidence": "name:wall"
  }
 },
 {
  "atom_id": "crowd-control-mobility.cc-immunity",
  "family": "crowd-control-mobility",
  "behavior": "KSanteR",
  "trigger": "on_cast",
  "target_policy": "self",
  "parameters": {
   "cooldown": [
    120.0,
    120.0,
    100.0,
    80.0,
    80.0,
    80.0,
    80.0
   ],
   "cast_range": [
    350.0,
    350.0,
    350.0,
    350.0,
    350.0,
    350.0,
    350.0
   ],
   "mana_cost": null,
   "damage": [
    45.0,
    80.0,
    115.0,
    150.0,
    185.0,
    220.0,
    255.0
   ],
   "duration": [
    15.0,
    15.0,
    15.0,
    15.0,
    15.0,
    15.0,
    15.0
   ],
   "ratios": {
    "TotalDamageSlamDown": [
     0.05
    ]
   },
   "tick_rate": null,
   "stacks_cap": null,
   "damage_type": "physical",
   "affects_type_flags": 16386
  },
  "states": [
   {
    "state": "cast",
    "duration": null,
    "behavior": "winding up",
    "atoms": [
     "crowd-control-mobility.cc-immunity"
    ]
   },
   {
    "state": "channel",
    "duration": null,
    "behavior": "channel",
    "atoms": [
     "crowd-control-mobility.cc-immunity"
    ]
   }
  ],
  "cycle": {
   "cooldown_seconds": {
    "rank1": 120.0,
    "rank_max": 80.0
   },
   "cast_time_seconds": null,
   "uptime_fraction": 0.125,
   "reset_on": [],
   "tempo_class": "utility"
  },
  "relations": [],
  "provenance": {
   "wiki": [
    "Crowd control",
    "Types of Crowd Control/Summary",
    "Slow resist"
   ],
   "binary": [
    "Characters/KSante/Spells/KSanteRAbility/KSanteR"
   ],
   "evidence": "tag:Trait_CCImmune"
  }
 },
 {
  "atom_id": "crowd-control-mobility.immobilize",
  "family": "crowd-control-mobility",
  "behavior": "KSanteR",
  "trigger": "on_cast",
  "target_policy": "enemy",
  "parameters": {
   "cooldown": [
    120.0,
    120.0,
    100.0,
    80.0,
    80.0,
    80.0,
    80.0
   ],
   "cast_range": [
    350.0,
    350.0,
    350.0,
    350.0,
    350.0,
    350.0,
    350.0
   ],
   "mana_cost": null,
   "damage": [
    45.0,
    80.0,
    115.0,
    150.0,
    185.0,
    220.0,
    255.0
   ],
   "duration": [
    15.0,
    15.0,
    15.0,
    15.0,
    15.0,
    15.0,
    15.0
   ],
   "ratios": {
    "TotalDamageSlamDown": [
     0.05
    ]
   },
   "tick_rate": null,
   "stacks_cap": null,
   "damage_type": "physical",
   "affects_type_flags": 16386
  },
  "states": [
   {
    "state": "cast",
    "duration": null,
    "behavior": "winding up",
    "atoms": [
     "crowd-control-mobility.immobilize"
    ]
   },
   {
    "state": "channel",
    "duration": null,
    "behavior": "channel",
    "atoms": [
     "crowd-control-mobility.immobilize"
    ]
   }
  ],
  "cycle": {
   "cooldown_seconds": {
    "rank1": 120.0,
    "rank_max": 80.0
   },
   "cast_time_seconds": null,
   "uptime_fraction": 0.125,
   "reset_on": [],
   "tempo_class": "utility"
  },
  "relations": [],
  "provenance": {
   "wiki": [
    "Crowd control",
    "Types of Crowd Control/Summary",
    "Tenacity"
   ],
   "binary": [
    "Characters/KSante/Spells/KSanteRAbility/KSanteR"
   ],
   "evidence": "tag:Trait_ImmobilizingCCSpell"
  }
 },
 {
  "atom_id": "crowd-control-mobility.knockback",
  "family": "crowd-control-mobility",
  "behavior": "KSanteR",
  "trigger": "on_cast",
  "target_policy": "enemy",
  "parameters": {
   "cooldown": [
    120.0,
    120.0,
    100.0,
    80.0,
    80.0,
    80.0,
    80.0
   ],
   "cast_range": [
    350.0,
    350.0,
    350.0,
    350.0,
    350.0,
    350.0,
    350.0
   ],
   "mana_cost": null,
   "damage": [
    45.0,
    80.0,
    115.0,
    150.0,
    185.0,
    220.0,
    255.0
   ],
   "duration": [
    15.0,
    15.0,
    15.0,
    15.0,
    15.0,
    15.0,
    15.0
   ],
   "ratios": {
    "TotalDamageSlamDown": [
     0.05
    ]
   },
   "tick_rate": null,
   "stacks_cap": null,
   "damage_type": "physical",
   "affects_type_flags": 16386
  },
  "states": [
   {
    "state": "cast",
    "duration": null,
    "behavior": "winding up",
    "atoms": [
     "crowd-control-mobility.knockback"
    ]
   },
   {
    "state": "channel",
    "duration": null,
    "behavior": "channel",
    "atoms": [
     "crowd-control-mobility.knockback"
    ]
   }
  ],
  "cycle": {
   "cooldown_seconds": {
    "rank1": 120.0,
    "rank_max": 80.0
   },
   "cast_time_seconds": null,
   "uptime_fraction": 0.125,
   "reset_on": [],
   "tempo_class": "utility"
  },
  "relations": [],
  "provenance": {
   "wiki": [
    "Types of Crowd Control"
   ],
   "binary": [
    "Characters/KSante/Spells/KSanteRAbility/KSanteR"
   ],
   "evidence": "tag:Trait_KnockBack"
  }